[
  {
    "year": "2020",
    "title": "ITU COP guidelines",
    "accent": "general",
    "detail": "Continental and international baseline referenced in the brief."
  },
  {
    "year": "Feb 2024",
    "title": "AU COP Policy adopted",
    "accent": "binding",
    "detail": "The brief identifies the African Union Child Online Safety and Empowerment Policy as the key continental policy trigger."
  },
  {
    "year": "2024",
    "title": "Tanzania amendments and Ghana framework",
    "accent": "binding",
    "detail": "The brief groups Tanzania's amendments and Ghana's framework work inside the acceleration period."
  },
  {
    "year": "2024",
    "title": "Mali and Senegal DPA directives",
    "accent": "draft",
    "detail": "The brief uses these directives to show data protection authorities acting before dedicated COP laws exist."
  },
  {
    "year": "2025",
    "title": "Kenya guidelines and Zambia strategy",
    "accent": "draft",
    "detail": "The brief treats Kenya and Zambia as important 2025 implementation-stage examples."
  },
  {
    "year": "2026",
    "title": "Gabon ordinance and rights-risk warnings",
    "accent": "none",
    "detail": "The brief uses Gabon and later rights-risk cases to show the next phase of the debate."
  }
]
