[
  {
    "year": "2020",
    "title": "ITU COP guidelines",
    "accent": "general",
    "detail": "Continental and international baseline referenced in the brief."
  },
  {
    "year": "Feb 2024",
    "title": "AU COP Policy adopted",
    "accent": "binding",
    "detail": "The African Union Child Online Safety and Empowerment Policy is the key continental policy trigger."
  },
  {
    "year": "2024",
    "title": "Tanzania amendments and Ghana framework",
    "accent": "binding",
    "detail": "Tanzania's amendments and Ghana's framework work fall inside the acceleration period."
  },
  {
    "year": "2024",
    "title": "Mali and Senegal DPA directives",
    "accent": "draft",
    "detail": "These directives show data protection authorities acting before dedicated COP laws exist."
  },
  {
    "year": "2025",
    "title": "Kenya guidelines and Zambia strategy",
    "accent": "draft",
    "detail": "Kenya and Zambia are important 2025 implementation-stage examples."
  },
  {
    "year": "2026",
    "title": "Gabon ordinance and rights-risk warnings",
    "accent": "none",
    "detail": "Gabon and later rights-risk cases mark the next phase of the debate."
  }
]
